{
  "catalog_id": "transport-implementation-presets",
  "catalog_version": "v0.1.0",
  "description": "Transport implementation presets for 3B pump parasitic and gas-management modeling. 3B-spec §10.2.",
  "presets": [
    {
      "preset_id": "ti-passive-no-pump",
      "preset_version": "v0.1.0",
      "label": "Passive Transport — No Pump",
      "transport_class": "passive",
      "pump_model_mode": "none",
      "pump_power_input_w": null,
      "pump_efficiency_fraction": null,
      "pressure_drop_pa": null,
      "mass_flow_kg_per_s": null,
      "fluid_density_kg_per_m3_override": null,
      "gas_management_mode": "not_applicable",
      "allowable_void_fraction": null,
      "declared_void_fraction": null,
      "bubble_blanketing_penalty_fraction": null,
      "gas_lock_flow_derate_fraction": null,
      "separator_type": "none",
      "notes": "Passive transport; no pump parasitic contribution. Zero transport resistance addition."
    },
    {
      "preset_id": "ti-pumped-liquid-direct-power-10w",
      "preset_version": "v0.1.0",
      "label": "Pumped Single-Phase Liquid — Direct Power 10W",
      "transport_class": "pumped_single_phase_liquid",
      "pump_model_mode": "direct_power",
      "pump_power_input_w": 10.0,
      "pump_efficiency_fraction": null,
      "pressure_drop_pa": null,
      "mass_flow_kg_per_s": null,
      "fluid_density_kg_per_m3_override": null,
      "gas_management_mode": "single_phase_intended",
      "allowable_void_fraction": 0.02,
      "declared_void_fraction": 0.0,
      "bubble_blanketing_penalty_fraction": 0.05,
      "gas_lock_flow_derate_fraction": 0.02,
      "separator_type": "reservoir",
      "notes": "Single-phase liquid loop with direct pump power declaration at 10W. Conservative gas-management posture with reservoir separator."
    },
    {
      "preset_id": "ti-pumped-liquid-pressure-drop-flow",
      "preset_version": "v0.1.0",
      "label": "Pumped Single-Phase Liquid — Pressure Drop / Flow",
      "transport_class": "pumped_single_phase_liquid",
      "pump_model_mode": "pressure_drop_flow",
      "pump_power_input_w": null,
      "pump_efficiency_fraction": 0.65,
      "pressure_drop_pa": 5000.0,
      "mass_flow_kg_per_s": 0.05,
      "fluid_density_kg_per_m3_override": null,
      "gas_management_mode": "single_phase_intended",
      "allowable_void_fraction": 0.02,
      "declared_void_fraction": 0.0,
      "bubble_blanketing_penalty_fraction": 0.05,
      "gas_lock_flow_derate_fraction": 0.02,
      "separator_type": "reservoir",
      "notes": "Pressure-drop / flow primitive ownership set. Density resolved from working-fluid schema field unless overridden."
    }
  ]
}
